<?xml version="1.0"?>
	<particles 
	xmlns:xsi="http://www.w3.org/2001/XMLSchema-instance"
	xsi:noNamespaceSchemaLocation="InputParticles.xsd">
		<particle>
			<position>
  				<x>0.0</x>
  				<y>0.0</y>
  				<z>0.0</z>
	  		</position>
  			<velocity>
  				<x>0.0</x>
  				<y>0.0</y>
  				<z>0.0</z>
  			</velocity>
  			<mass>1.0</mass>
		</particle>
		
		<particle>
			<position>
  				<x>0.0</x>
  				<y>1.0</y>
  				<z>0.0</z>
	  		</position>
  			<velocity>
  				<x>-1.0</x>
  				<y>0.0</y>
  				<z>0.0</z>
  			</velocity>
  			<mass>3.0e-6</mass>
		</particle>
		
		<particle>
			<position>
  				<x>0.0</x>
  				<y>5.36</y>
  				<z>0.0</z>
	  		</position>
  			<velocity>
  				<x>-0.425</x>
  				<y>0.0</y>
  				<z>0.0</z>
  			</velocity>
  			<mass>9.55e-4</mass>
		</particle>
		
		<particle>
			<position>
  				<x>34.75</x>
  				<y>0.0</y>
  				<z>0.0</z>
	  		</position>
  			<velocity>
  				<x>0.0</x>
  				<y>0.0296</y>
  				<z>0.0</z>
  			</velocity>
  			<mass>1.0e-14</mass>
		</particle>
	</particles>
